Название товара,Цена товара,Ссылка на товар
Подвесной светильник Ферум Orange,5490,https://www.divan.ru/product/podvesnoj-svetilnik-ferum-orange
Светильник потолочный Ринга Black,4390,https://www.divan.ru/product/svetilnik-potolochnyj-ringa-black
Торшер Бьйорк White,9890,https://www.divan.ru/product/torsher-bjork-white
Подвесной светильник Тубули-5 Wood,13 740,https://www.divan.ru/product/podvesnoj-svetilnik-tubuli-5-wood
Бра Смастен White,4060,https://www.divan.ru/product/bra-smasten-white
Настольная лампа Арвика Wood,6260,https://www.divan.ru/product/nastolnaya-lampa-arvika-wood
Подвесной светильник Инлада Wood,10 440,https://www.divan.ru/product/podvesnoj-svetilnik-inlada-wood
Настольная лампа Алней Orange,4390,https://www.divan.ru/product/nastolnaya-lampa-alnej-orange
Подвесной светильник Намсен Black,11 540,https://www.divan.ru/product/podvesnoj-svetilnik-namsen-black
Люстра Ливсден Brown,20 890,https://www.divan.ru/product/lyustra-livsden-brown
Торшер Логмар Silver,19 790,https://www.divan.ru/product/torsher-logmar-silver
Подвесной светильник Гронтри-1 Wood,14 620,https://www.divan.ru/product/podvesnoj-svetilnik-grontri-1-wood
Бра Бракетт White,4720,https://www.divan.ru/product/bra-brakett-white
Подвесной светильник Отра Wood,18 140,https://www.divan.ru/product/podvesnoj-svetilnik-otra-wood
Подвесной светильник Кронор Orange,8460,https://www.divan.ru/product/podvesnoj-svetilnik-kronor-orange
Светильник потолочный Орхус White,17 590,https://www.divan.ru/product/svetilnik-potolochnyj-orhus-white
Подвесной светильник Рена Green,4060,https://www.divan.ru/product/podvesnoj-svetilnik-rena-green
Светильник потолочный Ринга White,4390,https://www.divan.ru/product/svetilnik-potolochnyj-ringa-white
Бра Берит Black,5490,https://www.divan.ru/product/bra-berit-black
Подвесной светильник Кронор Black,8240,https://www.divan.ru/product/podvesnoj-svetilnik-kronor-black
Настольная лампа Бьйорк White,3620,https://www.divan.ru/product/nastolnaya-lampa-bjork-white
Подвесной светильник Селау-2 Glass,4060,https://www.divan.ru/product/podvesnoj-svetilnik-selau-2-glass
Подвесной светильник Джамби Rattan,15 060,https://www.divan.ru/product/podvesnoj-svetilnik-djambi-rattan
Бра Пинна Black,6590,https://www.divan.ru/product/bra-pinna-black
Подвесной светильник Бьйорк White,8790,https://www.divan.ru/product/podvesnoj-svetilnik-bjork-white
Торшер Осло Blue,19 790,https://www.divan.ru/product/torsher-oslo-blue
Торшер Логмар Black,19 790,https://www.divan.ru/product/torsher-logmar-black
Бра Бьйорк White,2740,https://www.divan.ru/product/bra-bjork-white
Подвесной светильник Арвика Wood,8460,https://www.divan.ru/product/podvesnoj-svetilnik-arvika-wood
Подвесной светильник Бенфлит Black,7140,https://www.divan.ru/product/podvesnoj-svetilnik-benflit-black
Светильник потолочный Орхус Black,17 590,https://www.divan.ru/product/svetilnik-potolochnyj-orhus-black
Настольная лампа Требен Orange,3290,https://www.divan.ru/product/nastolnaya-lampa-treben-orange
Настольная лампа Сканди White,5160,https://www.divan.ru/product/nastolnaya-lampa-skandi-white
Подвесной светильник Ливсден Brown,5160,https://www.divan.ru/product/podvesnoj-svetilnik-livsden-brown
Подвесной светильник Бейла Black,6590,https://www.divan.ru/product/podvesnoj-svetilnik-bejla-black
Светильник потолочный Лаго White,11 320,https://www.divan.ru/product/svetilnik-potolochnyj-lago-white
Подвесной светильник Чинкве Silver,5820,https://www.divan.ru/product/podvesnoj-svetilnik-chinkve-silver
Торшер Энкель Black,5820,https://www.divan.ru/product/torsher-enkel-black
Люстра Малинг Multi,18 690,https://www.divan.ru/product/lyustra-maling-multi
Подвесной светильник Джамби-1 Rattan,10 660,https://www.divan.ru/product/podvesnoj-svetilnik-djambi-1-rattan
Подвесной светильник Селау-1 Glass,4390,https://www.divan.ru/product/podvesnoj-svetilnik-selau-1-glass
Подвесной светильник Ферум Black,3290,https://www.divan.ru/product/podvesnoj-svetilnik-ferum-black
Бра Смастен Black,4060,https://www.divan.ru/product/bra-smasten-black
Подвесной светильник Кронор White,8240,https://www.divan.ru/product/podvesnoj-svetilnik-kronor-white
Подвесной светильник Тубули Wood,2960,https://www.divan.ru/product/podvesnoj-svetilnik-tubuli-wood
Настольная лампа Требен White,3290,https://www.divan.ru/product/nastolnaya-lampa-treben-white
Подвесной светильник Ферум Grey,2740,https://www.divan.ru/product/podvesnoj-svetilnik-ferum-grey
Подвесной светильник Квина Black,7140,https://www.divan.ru/product/podvesnoj-svetilnik-kvina-black
